{
  "catalog_id": "payroll-parameters-synthetic-v1",
  "version": "1.1.0",
  "scope": "Fixtures synthetiques LOT 4D pour modeliser des parametres de paie sans valeur INEOS applicable",
  "fixture_type": "synthetic_example",
  "security_notice": "Exemple synthetique uniquement. Les valeurs ne doivent pas etre appliquees a un salarie ni reutilisees comme droits INEOS.",
  "parameters": [
    {
      "parameter_id": "PARAM_DUREE_MENSUELLE_REF_SYN",
      "parameter_code": "DUREE_MENS_REF_SYN",
      "label": "Duree mensuelle de reference synthetique",
      "business_description": "Parametre fictif permettant d'identifier la duree mensuelle necessaire a certains controles de paie.",
      "data_role": "source_data",
      "parameter_type": "duration",
      "value_state": "synthetic_test_value",
      "value_kind": "entered_data",
      "value": { "raw": "123,45 heures - valeur fictive non applicable", "numeric_value": 123.45, "unit": "hours", "currency": null, "percentage": null, "is_fallback_value": false },
      "employee_population": ["tous"],
      "work_schedule": ["tous_regimes"],
      "application_period": { "label": "periode fictive ouverte", "start_date": "2026-01-01", "end_date": null, "notes": ["Periode synthetique pour tests uniquement."] },
      "source_layer": "synthetic_fixture",
      "source_document": "Fixture synthetique LOT 4D - duree mensuelle",
      "source_reference": "fixture:param:duree-mensuelle",
      "effective_date": "2026-01-01",
      "end_date": null,
      "linked_rule_ids": ["PAY_HSUP_TRANCHES_001"],
      "linked_variables": ["base_horaire", "periode"],
      "linked_nibelis_rubric_ids": ["NIB_RUB_SALAIRE_BASE", "NIB_RUB_HSUP_BASE"],
      "linked_kelio_counter_ids": ["KELIO_HS_SYN"],
      "calculation_allowed": false,
      "legal_priority": "to_verify",
      "validation_status": "synthetic_example",
      "human_validation": { "status": "pending", "validator": "expert_paie_humain", "validated_at": null, "notes": ["Valeur fictive non validee."] },
      "confidence": "low",
      "confidentiality": "internal",
      "verified_by": "expert_paie_humain",
      "last_checked_at": null,
      "validation_documents": ["accord temps de travail a verifier", "bulletin anonymise futur"],
      "misuse_risks": ["Transformer une duree fictive en base de calcul reelle."],
      "mutually_exclusive_group": null,
      "synthetic_only": true,
      "notes": ["Valeur pedagogique volontairement non applicable."]
    },
    {
      "parameter_id": "PARAM_DUREE_HEBDO_REF_SYN",
      "parameter_code": "DUREE_HEBDO_REF_SYN",
      "label": "Duree hebdomadaire de reference synthetique",
      "business_description": "Parametre fictif representant une duree hebdomadaire utile au controle du declenchement d'heures.",
      "data_role": "source_data",
      "parameter_type": "duration",
      "value_state": "synthetic_test_value",
      "value_kind": "entered_data",
      "value": { "raw": "12,34 heures - valeur fictive non applicable", "numeric_value": 12.34, "unit": "hours", "currency": null, "percentage": null, "is_fallback_value": false },
      "employee_population": ["tous"],
      "work_schedule": ["tous_regimes"],
      "application_period": { "label": "periode fictive ouverte", "start_date": "2026-01-01", "end_date": null, "notes": ["Periode synthetique pour tests uniquement."] },
      "source_layer": "synthetic_fixture",
      "source_document": "Fixture synthetique LOT 4D - duree hebdomadaire",
      "source_reference": "fixture:param:duree-hebdo",
      "effective_date": "2026-01-01",
      "end_date": null,
      "linked_rule_ids": ["PAY_HSUP_TRANCHES_001"],
      "linked_variables": ["seuil_declenchement", "semaine_ou_cycle"],
      "linked_nibelis_rubric_ids": ["NIB_RUB_HSUP_BASE"],
      "linked_kelio_counter_ids": ["KELIO_HS_SYN"],
      "calculation_allowed": false,
      "legal_priority": "to_verify",
      "validation_status": "synthetic_example",
      "human_validation": { "status": "pending", "validator": "expert_paie_humain", "validated_at": null, "notes": ["Valeur fictive non validee."] },
      "confidence": "low",
      "confidentiality": "internal",
      "verified_by": "expert_paie_humain",
      "last_checked_at": null,
      "validation_documents": ["accord temps de travail a verifier", "releve Kelio anonymise futur"],
      "misuse_risks": ["Declencher a tort des heures supplementaires."],
      "mutually_exclusive_group": null,
      "synthetic_only": true,
      "notes": ["Ne pas comparer a une duree legale ou conventionnelle."]
    },
    {
      "parameter_id": "PARAM_HSUP_SEUIL_SYN",
      "parameter_code": "HSUP_SEUIL_SYN",
      "label": "Seuil de declenchement heures supplementaires synthetique",
      "business_description": "Parametre fictif signalant qu'un seuil de declenchement doit etre source, date et valide.",
      "data_role": "source_data",
      "parameter_type": "threshold",
      "value_state": "awaiting_human_validation",
      "value_kind": "entered_data",
      "value": { "raw": "88,80 heures - seuil fictif non applicable", "numeric_value": 88.8, "unit": "hours", "currency": null, "percentage": null, "is_fallback_value": false },
      "employee_population": ["tous"],
      "work_schedule": ["tous_regimes"],
      "application_period": { "label": "periode fictive ouverte", "start_date": "2026-01-01", "end_date": null, "notes": ["Doit etre remplace par une source reelle avant usage."] },
      "source_layer": "synthetic_fixture",
      "source_document": "Fixture synthetique LOT 4D - seuil HS",
      "source_reference": "fixture:param:hsup-seuil",
      "effective_date": "2026-01-01",
      "end_date": null,
      "linked_rule_ids": ["PAY_HSUP_TRANCHES_001"],
      "linked_variables": ["seuil_declenchement", "heures_validees", "semaine_ou_cycle"],
      "linked_nibelis_rubric_ids": ["NIB_RUB_HSUP_BASE", "NIB_RUB_HSUP_MAJ"],
      "linked_kelio_counter_ids": ["KELIO_HS_SYN"],
      "calculation_allowed": false,
      "legal_priority": "to_verify",
      "validation_status": "synthetic_example",
      "human_validation": { "status": "pending", "validator": "expert_paie_humain", "validated_at": null, "notes": ["Validation humaine obligatoire avant toute interpretation."] },
      "confidence": "low",
      "confidentiality": "internal",
      "verified_by": "expert_paie_humain",
      "last_checked_at": null,
      "validation_documents": ["accord applicable", "export Kelio anonymise", "bulletin anonymise"],
      "misuse_risks": ["Payer ou reclamer des heures sur une base fictive."],
      "mutually_exclusive_group": "hsup_seuil_syn",
      "synthetic_only": true,
      "notes": ["Exemple de parametre en attente de validation humaine."]
    },
    {
      "parameter_id": "PARAM_HSUP_MAJ_SYN",
      "parameter_code": "HSUP_MAJ_SYN",
      "label": "Majoration heures supplementaires synthetique",
      "business_description": "Parametre fictif representant un niveau de majoration d'heures supplementaires.",
      "data_role": "source_data",
      "parameter_type": "rate",
      "value_state": "synthetic_test_value",
      "value_kind": "entered_data",
      "value": { "raw": "17,30% - taux fictif non applicable", "numeric_value": 17.3, "unit": "rate_percent", "currency": null, "percentage": 17.3, "is_fallback_value": false },
      "employee_population": ["tous"],
      "work_schedule": ["tous_regimes"],
      "application_period": { "label": "periode fictive ouverte", "start_date": "2026-01-01", "end_date": null, "notes": ["Taux pedagogique sans valeur juridique."] },
      "source_layer": "synthetic_fixture",
      "source_document": "Fixture synthetique LOT 4D - majoration HS",
      "source_reference": "fixture:param:hsup-majoration",
      "effective_date": "2026-01-01",
      "end_date": null,
      "linked_rule_ids": ["PAY_HSUP_TRANCHES_001"],
      "linked_variables": ["valeur_applicable", "heures_validees", "base_horaire"],
      "linked_nibelis_rubric_ids": ["NIB_RUB_HSUP_MAJ"],
      "linked_kelio_counter_ids": ["KELIO_HS_SYN"],
      "calculation_allowed": false,
      "legal_priority": "to_verify",
      "validation_status": "synthetic_example",
      "human_validation": { "status": "pending", "validator": "expert_paie_humain", "validated_at": null, "notes": ["Non valide pour calcul."] },
      "confidence": "low",
      "confidentiality": "internal",
      "verified_by": "expert_paie_humain",
      "last_checked_at": null,
      "validation_documents": ["accord applicable", "rubriques bulletin anonymisees"],
      "misuse_risks": ["Confondre un taux fictif avec un taux applicable."],
      "mutually_exclusive_group": "hsup_majoration_syn",
      "synthetic_only": true,
      "notes": ["Ne pas rapprocher automatiquement d'un bareme reel."]
    },
    {
      "parameter_id": "PARAM_NUIT_MAJ_SYN",
      "parameter_code": "NUIT_MAJ_SYN",
      "label": "Majoration nuit synthetique",
      "business_description": "Parametre fictif pour qualifier le besoin d'une source sur la majoration ou prime de nuit.",
      "data_role": "source_data",
      "parameter_type": "rate",
      "value_state": "synthetic_test_value",
      "value_kind": "entered_data",
      "value": { "raw": "18,70% - taux fictif non applicable", "numeric_value": 18.7, "unit": "rate_percent", "currency": null, "percentage": 18.7, "is_fallback_value": false },
      "employee_population": ["personnel_poste"],
      "work_schedule": ["5x8", "nuit"],
      "application_period": { "label": "periode fictive ouverte", "start_date": "2026-01-01", "end_date": null, "notes": ["Aucune valeur INEOS encodee."] },
      "source_layer": "synthetic_fixture",
      "source_document": "Fixture synthetique LOT 4D - nuit",
      "source_reference": "fixture:param:nuit",
      "effective_date": "2026-01-01",
      "end_date": null,
      "linked_rule_ids": [],
      "linked_variables": ["jour", "heures_travaillees"],
      "linked_nibelis_rubric_ids": ["NIB_RUB_NUIT"],